kind,symbol,title
s,A,HUMAN NECESSITIES
c,A01,AGRICULTUREFORESTRYANIMAL HUSBANDRYHUNTINGTRAPPINGFISHING
u,A01B,"SOIL WORKING IN AGRICULTURE OR FORESTRYPARTS, DETAILS, OR ACCESSORIES OF AGRICULTURAL MACHINES OR IMPLEMENTS, IN GENERALmaking or covering furrows or holes for sowing, planting or manuring machines for harvesting root crops mowers convertible to soil working apparatus or capable of soil working mowers combined with soil working implements soil working for engineering purposes , ,"
u,A01C,"PLANTINGSOWINGFERTILISINGparts, details or accessories of agricultural machines or implements, in general"
u,A01D,HARVESTINGMOWING
u,A01F,"THRESHINGcombines BALING OF STRAW, HAY OR THE LIKESTATIONARY APPARATUS OR HAND TOOLS FOR FORMING OR BINDING STRAW, HAY OR THE LIKE INTO BUNDLESCUTTING OF STRAW, HAY OR THE LIKESTORING AGRICULTURAL OR HORTICULTURAL PRODUCEarrangements for making or setting stacks in connection with harvesting"
u,A01G,"HORTICULTURECULTIVATION OF VEGETABLES, FLOWERS, RICE, FRUIT, VINES, HOPS OR SEAWEEDFORESTRYWATERINGpicking of fruits, vegetables, hops or the like  propagating unicellular algae"
u,A01H,NEW PLANTS OR PROCESSES FOR OBTAINING THEMPLANT REPRODUCTION BY TISSUE CULTURE TECHNIQUES
u,A01J,"MANUFACTURE OF DAIRY PRODUCTSfor chemical matters, see subclass"
u,A01K,"ANIMAL HUSBANDRYAVICULTUREAPICULTUREPISCICULTUREFISHINGREARING OR BREEDING ANIMALS, NOT OTHERWISE PROVIDED FORNEW BREEDS OF ANIMALS"
u,A01L,SHOEING OF ANIMALS
u,A01M,"CATCHING, TRAPPING OR SCARING OF ANIMALSappliances for catching swarms or drone-catching   fishing   biocides, pest repellants or attractants APPARATUS FOR THE DESTRUCTION OF NOXIOUS ANIMALS OR NOXIOUS PLANTS"
u,A01N,"PRESERVATION OF BODIES OF HUMANS OR ANIMALS OR PLANTS OR PARTS THEREOF preservation of food or foodstuff BIOCIDES, e.g. AS DISINFECTANTS, AS PESTICIDES OR AS HERBICIDES preparations for medical, dental or toiletry purposes which kill or prevent the growth or proliferation of unwanted organisms PEST REPELLANTS OR ATTRACTANTSPLANT GROWTH REGULATORS"
u,A01P,"BIOCIDAL, PEST REPELLANT, PEST ATTRACTANT OR PLANT GROWTH REGULATORY ACTIVITY OF CHEMICAL COMPOUNDS OR PREPARATIONS"
c,A21,BAKINGEQUIPMENT FOR MAKING OR PROCESSING DOUGHSDOUGHS FOR BAKING
u,A21B,BAKERS' OVENSMACHINES OR EQUIPMENT FOR BAKINGdomestic baking equipment
u,A21C,MACHINES OR EQUIPMENT FOR MAKING OR PROCESSING DOUGHSHANDLING BAKED ARTICLES MADE FROM DOUGH
u,A21D,"TREATMENT, e.g. PRESERVATION, OF FLOUR OR DOUGH FOR BAKING, e.g. BY ADDITION OF MATERIALSBAKINGBAKERY PRODUCTSPRESERVATION THEREOF"
c,A22,BUTCHERINGMEAT TREATMENTPROCESSING POULTRY OR FISH
u,A22B,SLAUGHTERING
u,A22C,"PROCESSING MEAT, POULTRY, OR FISHpreserving obtaining protein compositions for foodstuffs fish, meat or poultry preparations disintegrating, e.g. chopping meat, preparation of proteins"
c,A23,"FOODS OR FOODSTUFFSTREATMENT THEREOF, NOT COVERED BY OTHER CLASSES"
u,A23B,"PRESERVING, e.g. BY CANNING, MEAT, FISH, EGGS, FRUIT, VEGETABLES, EDIBLE SEEDSCHEMICAL RIPENING OF FRUIT OR VEGETABLESTHE PRESERVED, RIPENED, OR CANNED PRODUCTS"
u,A23C,"DAIRY PRODUCTS, e.g. MILK, BUTTER OR CHEESEMILK OR CHEESE SUBSTITUTESMAKING THEREOF obtaining protein compositions for foodstuffs"
u,A23D,"EDIBLE OILS OR FATS, e.g. MARGARINES, SHORTENINGS, COOKING OILSobtaining, refining, preserving , hydrogenation"
u,A23F,"COFFEETEATHEIR SUBSTITUTESMANUFACTURE, PREPARATION, OR INFUSION THEREOF"
u,A23G,"COCOACOCOA PRODUCTS, e.g. CHOCOLATESUBSTITUTES FOR COCOA OR COCOA PRODUCTSCONFECTIONERYCHEWING GUMICE-CREAMPREPARATION THEREOF"
u,A23J,PROTEIN COMPOSITIONS FOR FOODSTUFFSWORKING-UP PROTEINS FOR FOODSTUFFSPHOSPHATIDE COMPOSITIONS FOR FOODSTUFFS
u,A23K,FEEDING-STUFFS SPECIALLY ADAPTED FOR ANIMALSMETHODS SPECIALLY ADAPTED FOR PRODUCTION THEREOF
u,A23L,"FOODS, FOODSTUFFS, OR NON-ALCOHOLIC BEVERAGES, NOT COVERED BY SUBCLASSES  OR THEIR PREPARATION OR TREATMENT, e.g. COOKING, MODIFICATION OF NUTRITIVE QUALITIES, PHYSICAL TREATMENT shaping or working, not fully covered by this subclass, PRESERVATION OF FOODS OR FOODSTUFFS, IN GENERAL"
u,A23N,"MACHINES OR APPARATUS FOR TREATING HARVESTED FRUIT, VEGETABLES, OR FLOWER BULBS IN BULK, NOT OTHERWISE PROVIDED FORPEELING VEGETABLES OR FRUIT IN BULKAPPARATUS FOR PREPARING ANIMAL FEEDING-STUFFSmachines for cutting straw or fodder disintegrating, e.g. shredding, severing, e.g. cutting, splitting, slicing, ,"
u,A23P,"SHAPING OR WORKING OF FOODSTUFFS, NOT FULLY COVERED BY A SINGLE OTHER SUBCLASS"
c,A24,TOBACCOCIGARSCIGARETTESSIMULATED SMOKING DEVICESSMOKERS' REQUISITES
u,A24B,MANUFACTURE OR PREPARATION OF TOBACCO FOR SMOKING OR CHEWINGTOBACCOSNUFF
u,A24C,MACHINES FOR MAKING CIGARS OR CIGARETTES
u,A24D,CIGARSCIGARETTESTOBACCO SMOKE FILTERSMOUTHPIECES FOR CIGARS OR CIGARETTESMANUFACTURE OF TOBACCO SMOKE FILTERS OR MOUTHPIECES
u,A24F,"SMOKERS’ REQUISITESMATCH BOXESSIMULATED SMOKING DEVICESinhaling appliances for medical purposes, shaped like cigars, cigarettes or pipes"
c,A41,WEARING APPAREL
u,A41B,SHIRTSUNDERWEARBABY LINENHANDKERCHIEFS
u,A41C,CORSETSBRASSIÈRES
u,A41D,OUTERWEARPROTECTIVE GARMENTSACCESSORIES
u,A41F,GARMENT FASTENINGSSUSPENDERS
u,A41G,ARTIFICIAL FLOWERSWIGSMASKSFEATHERS
u,A41H,"APPLIANCES OR METHODS FOR MAKING CLOTHES, e.g. FOR DRESS-MAKING OR FOR TAILORING, NOT OTHERWISE PROVIDED FOR"
c,A42,HEADWEAR
u,A42B,HATSHEAD COVERINGS headbands  head-scarves
u,A42C,"MANUFACTURING OR TRIMMING HEAD COVERINGS, e.g. HATS"
c,A43,FOOTWEAR
u,A43B,CHARACTERISTIC FEATURES OF FOOTWEARPARTS OF FOOTWEAR
u,A43C,FASTENINGS OR ATTACHMENTS FOR FOOTWEARLACES IN GENERAL
u,A43D,"MACHINES, TOOLS, EQUIPMENT OR METHODS FOR MANUFACTURING OR REPAIRING FOOTWEARsewing"
c,A44,HABERDASHERYJEWELLERY
u,A44B,"BUTTONS, PINS, BUCKLES, SLIDE FASTENERS, OR THE LIKEfastenings specially adapted for footwear"
u,A44C,"PERSONAL ADORNMENTS, e.g. JEWELLERYCOINS"
c,A45,HAND OR TRAVELLING ARTICLES
u,A45B,"WALKING STICKSwalking aids, e.g. sticks, for blind persons UMBRELLASLADIES' OR LIKE FANScane or umbrella stands or holders"
u,A45C,PURSESLUGGAGEHAND CARRIED BAGS
u,A45D,"HAIRDRESSING OR SHAVING EQUIPMENT  wigs, toupees or the like ,   hairdressers' chairs   hair cutting appliances, razors EQUIPMENT FOR COSMETICS OR COSMETIC TREATMENTS, e.g. FOR MANICURING OR PEDICURING"
u,A45F,TRAVELLING OR CAMP EQUIPMENTSACKS OR PACKS CARRIED ON THE BODY
c,A46,BRUSHWARE
u,A46B,BRUSHEShandles not integral with brushware
u,A46D,MANUFACTURE OF BRUSHES
c,A47,FURNITUREDOMESTIC ARTICLES OR APPLIANCESCOFFEE MILLSSPICE MILLSSUCTION CLEANERS IN GENERAL
u,A47B,TABLESDESKSOFFICE FURNITURECABINETSDRAWERSGENERAL DETAILS OF FURNITUREjointing of furniture
u,A47C,CHAIRSseats specially adapted for vehicles SOFASBEDSupholstery in general
u,A47D,"FURNITURE SPECIALLY ADAPTED FOR CHILDRENschool benches or desks ,"
u,A47F,"SPECIAL FURNITURE, FITTINGS, OR ACCESSORIES FOR SHOPS, STOREHOUSES, BARS, RESTAURANTS, OR THE LIKEPAYING COUNTERS"
u,A47G,HOUSEHOLD OR TABLE EQUIPMENTbook-ends knives
u,A47H,"FURNISHINGS FOR WINDOWS OR DOORSconcerned with the functioning of the door or window roller blinds special arrangements or measures in connection with doors or windows, e.g. for ventilation or sealing,"
u,A47J,KITCHEN EQUIPMENTCOFFEE MILLSSPICE MILLSAPPARATUS FOR MAKING BEVERAGES
u,A47K,"SANITARY EQUIPMENT NOT OTHERWISE PROVIDED FORconnecting to water supply or waste pipe, sinks water-closets TOILET ACCESSORIEScosmetic equipment"
u,A47L,DOMESTIC WASHING OR CLEANINGbrushes cleaning quantities of bottles or of other hollow articles of one kind laundry SUCTION CLEANERS IN GENERALcleaning in general
c,A61,MEDICAL OR VETERINARY SCIENCEHYGIENE
u,A61B,"DIAGNOSISSURGERYIDENTIFICATIONanalysing biological material , e.g."
u,A61C,"DENTISTRYAPPARATUS OR METHODS FOR ORAL OR DENTAL HYGIENEnon-driven toothbrushes preparations for dentistry  preparations for cleaning the teeth or mouth ,"
u,A61D,"VETERINARY INSTRUMENTS, IMPLEMENTS, TOOLS, OR METHODS"
u,A61F,"FILTERS IMPLANTABLE INTO BLOOD VESSELSPROSTHESESDEVICES PROVIDING PATENCY TO, OR PREVENTING COLLAPSING OF, TUBULAR STRUCTURES OF THE BODY, e.g. STENTSORTHOPAEDIC, NURSING OR CONTRACEPTIVE DEVICESFOMENTATIONTREATMENT OR PROTECTION OF EYES OR EARSBANDAGES, DRESSINGS OR ABSORBENT PADSFIRST-AID KITSdental prosthetics"
u,A61G,"TRANSPORT, PERSONAL CONVEYANCES, OR ACCOMMODATION SPECIALLY ADAPTED FOR PATIENTS OR DISABLED PERSONSappliances for aiding patients or disabled persons to walk OPERATING TABLES OR CHAIRSCHAIRS FOR DENTISTRYFUNERAL DEVICESembalming corpses"
u,A61H,"PHYSICAL THERAPY APPARATUS, e.g. DEVICES FOR LOCATING OR STIMULATING REFLEX POINTS IN THE BODYARTIFICIAL RESPIRATIONMASSAGEBATHING DEVICES FOR SPECIAL THERAPEUTIC OR HYGIENIC PURPOSES OR SPECIFIC PARTS OF THE BODYelectrotherapy, magnetotherapy, radiation therapy, ultrasound therapy"
u,A61J,CONTAINERS SPECIALLY ADAPTED FOR MEDICAL OR PHARMACEUTICAL PURPOSESDEVICES OR METHODS SPECIALLY ADAPTED FOR BRINGING PHARMACEUTICAL PRODUCTS INTO PARTICULAR PHYSICAL OR ADMINISTERING FORMSDEVICES FOR ADMINISTERING FOOD OR MEDICINES ORALLYBABY COMFORTERSDEVICES FOR RECEIVING SPITTLE
u,A61K,"PREPARATIONS FOR MEDICAL, DENTAL OR TOILETRY PURPOSESdevices or methods specially adapted for bringing pharmaceutical products into particular physical or administering forms chemical aspects of, or use of materials for deodorisation of air, for disinfection or sterilisation, or for bandages, dressings, absorbent pads or surgical articles soap compositions"
u,A61L,"METHODS OR APPARATUS FOR STERILISING MATERIALS OR OBJECTS IN GENERALDISINFECTION, STERILISATION OR DEODORISATION OF AIRCHEMICAL ASPECTS OF BANDAGES, DRESSINGS, ABSORBENT PADS OR SURGICAL ARTICLESMATERIALS FOR BANDAGES, DRESSINGS, ABSORBENT PADS OR SURGICAL ARTICLESpreservation of bodies or disinfecting characterised by the agents employed preserving, e.g. sterilising, food or foodstuffs preparations for medical, dental or toiletry purposes"
u,A61M,"DEVICES FOR INTRODUCING MEDIA INTO, OR ONTO, THE BODYintroducing media into or onto the bodies of animals  means for inserting tampons  devices for administering food or medicines orally  containers for collecting, storing or administering blood or medical fluids DEVICES FOR TRANSDUCING BODY MEDIA OR FOR TAKING MEDIA FROM THE BODYsurgery  chemical aspects of surgical articles  magnetotherapy using magnetic elements placed within the body DEVICES FOR PRODUCING OR ENDING SLEEP OR STUPOR"
u,A61N,"ELECTROTHERAPYMAGNETOTHERAPYRADIATION THERAPYULTRASOUND THERAPYmeasurement of bioelectric currents surgical instruments, devices or methods for transferring non-mechanical forms of energy to or from the body anaesthetic apparatus in general incandescent lamps infrared radiators for heating"
u,A61P,SPECIFIC THERAPEUTIC ACTIVITY OF CHEMICAL COMPOUNDS OR MEDICINAL PREPARATIONS
u,A61Q,SPECIFIC USE OF COSMETICS OR SIMILAR TOILETRY PREPARATIONS
c,A62,LIFE-SAVINGFIRE-FIGHTING
u,A62B,"DEVICES, APPARATUS OR METHODS FOR LIFE-SAVINGvalves specially adapted for medical use composition of chemical substances used in respirators, gas-masks, breathing apparatus or the like rescuing from mountains or trees , life-saving devices, apparatus or methods specially adapted for use in water divers' equipment specially adapted for use with aircraft, e.g. parachutes or ejector seats, rescue devices peculiar to mining"
u,A62C,"FIRE-FIGHTINGfire-extinguishing compositions, use of chemical substances in extinguishing fires spraying, applying liquids or other fluent materials to surfaces in general fire-fighting aircraft alarm arrangements , e.g. fire alarms actuated by smoke or gases"
u,A62D,"CHEMICAL MEANS FOR EXTINGUISHING FIRESPROCESSES FOR MAKING HARMFUL CHEMICAL SUBSTANCES HARMLESS, OR LESS HARMFUL, BY EFFECTING A CHEMICAL CHANGECOMPOSITION OF MATERIALS FOR COVERINGS OR CLOTHING FOR PROTECTING AGAINST HARMFUL CHEMICAL AGENTSCOMPOSITION OF MATERIALS FOR TRANSPARENT PARTS OF GAS-MASKS, RESPIRATORS, BREATHING BAGS OR HELMETSCOMPOSITION OF CHEMICAL MATERIALS FOR USE IN BREATHING APPARATUS"
c,A63,SPORTSGAMESAMUSEMENTS
u,A63B,"APPARATUS FOR PHYSICAL TRAINING, GYMNASTICS, SWIMMING, CLIMBING, OR FENCINGBALL GAMESTRAINING EQUIPMENTapparatus for passive exercising, massage"
u,A63C,"SKATESSKISROLLER SKATESDESIGN OR LAYOUT OF COURTS, RINKS OR THE LIKEwater skis ,"
u,A63D,"BOWLING GAMES, e.g. SKITTLES, BOCCE OR BOWLSINSTALLATIONS THEREFORBAGATELLE OR SIMILAR GAMESBILLIARDSballs"
u,A63F,"CARD, BOARD OR ROULETTE GAMESINDOOR GAMES USING SMALL MOVING PLAYING BODIESVIDEO GAMESGAMES NOT OTHERWISE PROVIDED FOR"
u,A63G,MERRY-GO-ROUNDSSWINGSROCKING-HORSESswings or rocking horses as nursery furniture CHUTESSWITCHBACKSSIMILAR DEVICES FOR PUBLIC AMUSEMENT
u,A63H,"TOYS, e.g. TOPS, DOLLS, HOOPS OR BUILDING BLOCKS"
u,A63J,"DEVICES FOR THEATRES, CIRCUSES, OR THE LIKECONJURING APPLIANCES OR THE LIKE"
u,A63K,RACINGRIDING SPORTSEQUIPMENT OR ACCESSORIES THEREFORstop watches timing indicating arrangements for variable information by selection or combination of individual elements
c,A99,SUBJECT MATTER NOT OTHERWISE PROVIDED FOR IN THIS SECTION
u,A99Z,SUBJECT MATTER NOT OTHERWISE PROVIDED FOR IN THIS SECTION
s,B,PERFORMING OPERATIONSTRANSPORTING
c,B01,PHYSICAL OR CHEMICAL PROCESSES OR APPARATUS IN GENERAL
u,B01B,BOILINGBOILING APPARATUS
u,B01D,"SEPARATIONseparating solids from solids by wet methods , , by pneumatic jigs or tables , by other dry methods magnetic or electrostatic separation of solid materials from solid materials or fluids, separation by high-voltage electric fields centrifuges  vortex apparatus presses per se for squeezing-out liquid from liquid-containing material"
u,B01F,"MIXING, e.g. DISSOLVING, EMULSIFYING OR DISPERSING mixing paints"
u,B01J,"CHEMICAL OR PHYSICAL PROCESSES, e.g. CATALYSIS OR COLLOID CHEMISTRYTHEIR RELEVANT APPARATUS"
u,B01L,CHEMICAL OR PHYSICAL LABORATORY APPARATUS FOR GENERAL USE
c,B02,"CRUSHING, PULVERISING, OR DISINTEGRATINGPREPARATORY TREATMENT OF GRAIN FOR MILLING"
u,B02B,PREPARING GRAIN FOR MILLINGREFINING GRANULAR FRUIT TO COMMERCIAL PRODUCTS BY WORKING THE SURFACEmaking dough from cereals directly preservation or sterilisation of cereals cleaning fruit preparation of malt
u,B02C,"CRUSHING, PULVERISING, OR DISINTEGRATING IN GENERALMILLING GRAINobtaining metallic powder by crushing, grinding or milling"
c,B03,SEPARATION OF SOLID MATERIALS USING LIQUIDS OR USING PNEUMATIC TABLES OR JIGSMAGNETIC OR ELECTROSTATIC SEPARATION OF SOLID MATERIALS FROM SOLID MATERIALS OR FLUIDSSEPARATION BY HIGH-VOLTAGE ELECTRIC FIELDS
u,B03B,SEPARATING SOLID MATERIALS USING LIQUIDS OR USING PNEUMATIC TABLES OR JIGS
u,B03C,"MAGNETIC OR ELECTROSTATIC SEPARATION OF SOLID MATERIALS FROM SOLID MATERIALS OR FLUIDSSEPARATION BY HIGH-VOLTAGE ELECTRIC FIELDSseparating isotopes combinations of magnetic or electrostatic separation with separation of solids by other means ,"
u,B03D,FLOTATIONDIFFERENTIAL SEDIMENTATIONin combination with other separation of solids sink-float separation
c,B04,CENTRIFUGAL APPARATUS OR MACHINES FOR CARRYING-OUT PHYSICAL OR CHEMICAL PROCESSES
u,B04B,CENTRIFUGEShigh-speed drum mills
u,B04C,"APPARATUS USING FREE VORTEX FLOW, e.g. CYCLONESexhaust or silencing apparatus for machines or engines having means for removing solid constituents of exhaust, using inertial or centrifugal separators cyclonic type combustion apparatus"
c,B05,"SPRAYING OR ATOMISING IN GENERALAPPLYING FLUENT MATERIALS TO SURFACES, IN GENERAL"
u,B05B,SPRAYING APPARATUSATOMISING APPARATUSNOZZLESspray-mixers with nozzles processes for applying liquids or other fluent materials to surfaces by spraying
u,B05C,"APPARATUS FOR APPLYING FLUENT MATERIALS TO SURFACES, IN GENERALspraying apparatus, atomising apparatus, nozzles plant for applying liquids or other fluent materials to objects by electrostatic spraying"
u,B05D,"PROCESSES FOR APPLYING FLUENT MATERIALS TO SURFACES, IN GENERALconveying articles or workpieces through baths of liquid , e.g."
c,B06,GENERATING OR TRANSMITTING MECHANICAL VIBRATIONS IN GENERAL
u,B06B,"GENERATING OR TRANSMITTING MECHANICAL VIBRATIONS IN GENERALfor particular physical or chemical processes, see the relevant subclasses, e.g. , , , , measurement of mechanical vibrations, including the combination of generation and measurement, systems using reflection or reradiation of acoustic waves generating seismic energy for prospecting control of mechanical vibrations methods or devices for transmitting, conducting or directing sound, in general synthesis of acoustic waves piezoelectric, electrostrictive or magnetostrictive elements , motors with vibrating magnet, armature or coil motors using piezoelectric effect, electrostriction or magnetostriction generation of electrical oscillations electromechanical resonators as resonant circuit elements loudspeakers, microphones, gramophone pick-ups or like acoustic electromechanical transducers"
c,B07,SEPARATING SOLIDS FROM SOLIDSSORTING
u,B07B,"SEPARATING SOLIDS FROM SOLIDS BY SIEVING, SCREENING, SIFTING OR BY USING GAS CURRENTSSEPARATING BY OTHER DRY METHODS APPLICABLE TO BULK MATERIAL, e.g. LOOSE ARTICLES FIT TO BE HANDLED LIKE BULK MATERIALwet separating processes, sorting by processes using fluent material in the same way as liquid combinations of dry separating apparatus with wet separating apparatus using liquids , sorting by magnetic or electrostatic separation of solid materials from solid materials or fluids, separation by high voltage electric fields centrifuges or vortex apparatus for carrying out physical processes hand sorting, postal sorting, sorting by switching or other devices actuated in response to detection or measurement of some feature of articles or samples of material"
u,B07C,"POSTAL SORTINGSORTING INDIVIDUAL ARTICLES, OR BULK MATERIAL FIT TO BE SORTED PIECE-MEAL, e.g. BY PICKINGspecially adapted for a specific purpose covered by another class, see the relevant place, e.g. ,"
c,B08,CLEANING
u,B08B,"CLEANING IN GENERALPREVENTION OF FOULING IN GENERALbrushes devices for domestic or like cleaning separation of particles from liquids or gases separation of solids , spraying or applying liquids or other fluent materials to surfaces in general cleaning devices for conveyors concurrent cleaning, filling and closing of bottles inhibiting corrosion or incrustation in general cleaning streets, permanent ways, beaches or land parts, details or accessories of swimming or splash baths or pools, specially adapted for cleaning preventing or removing electrostatic charges"
c,B09,DISPOSAL OF SOLID WASTERECLAMATION OF CONTAMINATED SOIL
u,B09B,DISPOSAL OF SOLID WASTE NOT OTHERWISE PROVIDED FOR
u,B09C,"RECLAMATION OF CONTAMINATED SOILgatherers for removing stones or the like from the soil   sterilising soil by steam     removing undesirable matter, e.g. rubbish, from the land"
c,B21,MECHANICAL METAL-WORKING WITHOUT ESSENTIALLY REMOVING MATERIALPUNCHING METAL
u,B21B,"ROLLING OF METALauxiliary operations used in connection with metal-working operations covered in , seebending by rolling manufacture of particular objects, e.g. screws, wheels, rings, barrels, balls, by rolling pressure welding by means of a rolling mill"
u,B21C,"MANUFACTURE OF METAL SHEETS, WIRE, RODS, TUBES, PROFILES OR LIKE SEMI-MANUFACTURED PRODUCTS OTHERWISE THAN BY ROLLINGAUXILIARY OPERATIONS USED IN CONNECTION WITH METAL-WORKING WITHOUT ESSENTIALLY REMOVING MATERIAL"
u,B21D,"WORKING OR PROCESSING OF SHEET METAL OR METAL TUBES, RODS OR PROFILES WITHOUT ESSENTIALLY REMOVING MATERIALPUNCHING METALworking or processing of wire"
u,B21F,"WORKING OR PROCESSING OF METAL WIRErolling of metal by drawing, auxiliary operations used in connection with metal-working without essentially removing material bundling articles"
u,B21G,"MAKING NEEDLES, PINS OR NAILS OF METAL"
u,B21H,"MAKING PARTICULAR METAL OBJECTS BY ROLLING, e.g. SCREWS, WHEELS, RINGS, BARRELS, BALLSessentially from sheet metal"
u,B21J,"FORGINGHAMMERINGPRESSING METALRIVETINGFORGE FURNACESrolling of metal making particular products by forging or pressing cladding or plating finishing surfaces by hammering compacting surfaces by blasting with particulate material general features of presses, presses for consolidating scrap furnaces in general"
u,B21K,"MAKING FORGED OR PRESSED METAL PRODUCTS, e.g. HORSE-SHOES, RIVETS, BOLTS OR WHEELSmaking particular articles by working sheet metal without essentially removing material processing wire making pins, needles or nails making particular articles by rolling forging machines, pressing machines, hammering machines, in general making chains plating"
u,B21L,MAKING METAL CHAINSmaking chains or chain links by casting chains in general
c,B22,CASTINGPOWDER METALLURGY
u,B22C,FOUNDRY MOULDINGmoulding refractory materials in general
u,B22D,"CASTING OF METALSCASTING OF OTHER SUBSTANCES BY THE SAME PROCESSES OR DEVICESshaping of plastics or substances in a plastic state metallurgical processing, selection of substances to be added to metal ,"
u,B22F,WORKING METALLIC POWDERMANUFACTURE OF ARTICLES FROM METALLIC POWDERMAKING METALLIC POWDERmaking alloys by powder metallurgy APPARATUS OR DEVICES SPECIALLY ADAPTED FOR METALLIC POWDER
c,B23,MACHINE TOOLSMETAL-WORKING NOT OTHERWISE PROVIDED FOR
u,B23B,"TURNINGBORINGusing an electrode which takes the place of a tool , e.g. making holes working by laser beam arrangements for copying or controlling"
u,B23C,MILLINGbroaching broach-milling in making gears arrangements for copying or controlling
u,B23D,"PLANINGSLOTTINGSHEARINGBROACHINGSAWINGFILINGSCRAPINGLIKE OPERATIONS FOR WORKING METAL BY REMOVING MATERIAL, NOT OTHERWISE PROVIDED FORmaking toothed gears or the like cutting metal by applying heat locally arrangements for copying or controlling"
u,B23F,"MAKING GEARS OR TOOTHED RACKSby stamping by rolling by forging or pressing by casting arrangements for copying or controlling machines or devices for grinding or polishing, in general"
u,B23G,"THREAD CUTTINGWORKING OF SCREWS, BOLT HEADS OR NUTS, IN CONJUNCTION THEREWITHthread-forming by corrugating tubes  by rolling by forging, pressing or hammering  making helical grooves by turning by milling by grinding  arrangements for copying or controlling"
u,B23H,"WORKING OF METAL BY THE ACTION OF A HIGH CONCENTRATION OF ELECTRIC CURRENT ON A WORKPIECE USING AN ELECTRODE WHICH TAKES THE PLACE OF A TOOLSUCH WORKING COMBINED WITH OTHER FORMS OF WORKING OF METALprocesses for the electrolytic or electrophoretic production of coatings, electroforming, or apparatus therefor processes for the electrolytic removal of material from objects manufacturing printed circuits using precipitation techniques to apply the conductive material to form the desired conductive pattern"
u,B23K,"SOLDERING OR UNSOLDERINGWELDINGCLADDING OR PLATING BY SOLDERING OR WELDINGCUTTING BY APPLYING HEAT LOCALLY, e.g. FLAME CUTTINGWORKING BY LASER BEAMmaking metal-coated products by extruding metal building up linings or coverings by casting casting by dipping manufacture of composite layers by sintering metal powder arrangements on machine tools for copying or controlling covering metals or covering materials with metals, not otherwise provided for burners"
u,B23P,METAL-WORKING NOT OTHERWISE PROVIDED FORCOMBINED OPERATIONSUNIVERSAL MACHINE TOOLSarrangements for copying or controlling
u,B23Q,"DETAILS, COMPONENTS, OR ACCESSORIES FOR MACHINE TOOLS, e.g. ARRANGEMENTS FOR COPYING OR CONTROLLINGtools of the kind used in lathes or boring machines MACHINE TOOLS IN GENERAL, CHARACTERISED BY THE CONSTRUCTION OF PARTICULAR DETAILS OR COMPONENTSCOMBINATIONS OR ASSOCIATIONS OF METAL-WORKING MACHINES, NOT DIRECTED TO A PARTICULAR RESULT"
c,B24,GRINDINGPOLISHING
u,B24B,"MACHINES, DEVICES, OR PROCESSES FOR GRINDING OR POLISHINGby electro-erosion abrasive or related blasting  electrolytic etching or polishing DRESSING OR CONDITIONING OF ABRADING SURFACESFEEDING OF GRINDING, POLISHING, OR LAPPING AGENTS"
u,B24C,ABRASIVE OR RELATED BLASTING WITH PARTICULATE MATERIAL
u,B24D,"TOOLS FOR GRINDING, BUFFING OR SHARPENINGabrading-bodies specially designed for tumbling apparatus, e.g. abrading-balls honing tools lapping tools"
c,B25,HAND TOOLSPORTABLE POWER-DRIVEN TOOLSHANDLES FOR HAND IMPLEMENTSWORKSHOP EQUIPMENTMANIPULATORS
u,B25B,"TOOLS OR BENCH DEVICES NOT OTHERWISE PROVIDED FOR, FOR FASTENING, CONNECTING, DISENGAGING, OR HOLDING"
u,B25C,HAND-HELD NAILING OR STAPLING TOOLSMANUALLY-OPERATED PORTABLE STAPLING TOOLSmanufacturing footwear
u,B25D,PERCUSSIVE TOOLS
u,B25F,COMBINATION OR MULTI-PURPOSE TOOLS NOT OTHERWISE PROVIDED FORDETAILS OR COMPONENTS OF PORTABLE POWER-DRIVEN TOOLS NOT PARTICULARLY RELATED TO THE OPERATIONS PERFORMED AND NOT OTHERWISE PROVIDED FOR
u,B25G,HANDLES FOR HAND IMPLEMENTSattaching the blades or the like to handles of hand tools for soil working handles of hand implements for harvesting handles integral with brushware
u,B25H,"WORKSHOP EQUIPMENT, e.g. FOR MARKING-OUT WORKSTORAGE MEANS FOR WORKSHOPS"
u,B25J,"MANIPULATORSCHAMBERS PROVIDED WITH MANIPULATION DEVICESrobotic devices for individually picking fruits, vegetables, hops or the like needle manipulators for surgery manipulators associated with rolling mills manipulators associated with forging machines means for holding wheels or parts thereof cranes arrangements for handling fuel or other materials which are used within nuclear reactors structural combination of manipulators with cells or rooms shielded against radiation"
c,B26,HAND CUTTING TOOLSCUTTINGSEVERING
u,B26B,"HAND-HELD CUTTING TOOLS NOT OTHERWISE PROVIDED FORfor harvesting for horticulture, for forestry for butchering or meat treatment for manufacturing or repairing footwear nail clippers or cutters kitchen equipment for surgical purposes for metal cutting by abrasive fluid jets plier-like tools with cutting edges pincers handles for hand implements, in general guillotine-type cutters for erasing for textile materials"
